{
  "schemaVersion": "4.0.0",
  "algorithmVersion": "4.4.0",
  "recipeId": "recipe_be7868eb01994061a2b28f0543c99cb3",
  "preparationId": "prep_be7868eb01994061a2b28f0543c99cb3",
  "songId": "dongfanghong",
  "stageId": "stage_1",
  "generatedAt": "2026-09-01T02:05:39.186Z",
  "mode": "ACTIVITY_SEQUENCE",
  "source": {
    "learningProfileAlgorithmVersion": "1.1.0",
    "learningProfileGeneratedAt": "2026-08-31T16:51:14.414Z",
    "scoreVerifiedAt": "2026-08-31T14:27:05.314Z"
  },
  "songContext": {
    "meter": {
      "beats": 2,
      "unit": 4
    },
    "bpm": 72
  },
  "selection": {
    "activityTypes": [
      "listen",
      "melody_trace",
      "rhythm_learning",
      "singing",
      "ensemble",
      "sticker_arrangement"
    ],
    "rhythmMaterialIds": [
      "PAT-04",
      "PAT-01",
      "PAT-02"
    ],
    "measuresPerUnit": 4
  },
  "classFlow": [
    {
      "activityId": "act_listen",
      "type": "listen",
      "order": 1
    },
    {
      "activityId": "act_melody_trace",
      "type": "melody_trace",
      "order": 2
    },
    {
      "activityId": "act_rhythm_learning",
      "type": "rhythm_learning",
      "order": 3
    },
    {
      "activityId": "act_singing",
      "type": "singing",
      "order": 4
    },
    {
      "activityId": "act_ensemble",
      "type": "ensemble",
      "order": 5
    },
    {
      "activityId": "act_sticker_arrangement",
      "type": "sticker_arrangement",
      "order": 6
    }
  ],
  "activities": [
    {
      "activityId": "act_listen",
      "type": "listen",
      "teachingAssetIds": [],
      "materialIds": [],
      "teachingUnitIds": [],
      "bindings": {
        "scope": {
          "type": "full_song"
        },
        "source": "original_audio",
        "bodyWarmup": true,
        "bodyPlanId": "song_listening_body_plan"
      }
    },
    {
      "activityId": "act_melody_trace",
      "type": "melody_trace",
      "teachingAssetIds": [],
      "materialIds": [],
      "teachingUnitIds": [
        "lesson_segment_m001_m004",
        "lesson_segment_m005_m008",
        "lesson_segment_m009_m012",
        "lesson_segment_m013_m016"
      ],
      "bindings": {
        "scope": {
          "type": "lesson_segments"
        },
        "tracePlanId": "song_melody_trace_plan",
        "measureAlignmentId": "song_measure_alignment",
        "measuresPerUnit": 4,
        "lessonSegments": [
          {
            "segmentId": "lesson_segment_m001_m004",
            "index": 0,
            "label": "第 1–4 小节",
            "startMeasure": 1,
            "endMeasure": 4,
            "measureCount": 4,
            "measures": [
              1,
              2,
              3,
              4
            ]
          },
          {
            "segmentId": "lesson_segment_m005_m008",
            "index": 1,
            "label": "第 5–8 小节",
            "startMeasure": 5,
            "endMeasure": 8,
            "measureCount": 4,
            "measures": [
              5,
              6,
              7,
              8
            ]
          },
          {
            "segmentId": "lesson_segment_m009_m012",
            "index": 2,
            "label": "第 9–12 小节",
            "startMeasure": 9,
            "endMeasure": 12,
            "measureCount": 4,
            "measures": [
              9,
              10,
              11,
              12
            ]
          },
          {
            "segmentId": "lesson_segment_m013_m016",
            "index": 3,
            "label": "第 13–16 小节",
            "startMeasure": 13,
            "endMeasure": 16,
            "measureCount": 4,
            "measures": [
              13,
              14,
              15,
              16
            ]
          }
        ]
      }
    },
    {
      "activityId": "act_rhythm_learning",
      "type": "rhythm_learning",
      "teachingAssetIds": [
        "TA-RHY-PAT-04",
        "TA-RHY-PAT-01",
        "TA-RHY-PAT-02"
      ],
      "materialIds": [
        "PAT-04",
        "PAT-01",
        "PAT-02"
      ],
      "teachingUnitIds": [
        "lesson_segment_m001_m004",
        "lesson_segment_m005_m008",
        "lesson_segment_m009_m012",
        "lesson_segment_m013_m016"
      ],
      "bindings": {
        "patternIds": [
          "PAT-04",
          "PAT-01",
          "PAT-02"
        ],
        "patterns": [
          {
            "materialId": "PAT-04",
            "teachingAssetId": "TA-RHY-PAT-04",
            "occurrenceIds": [
              "PAT-04@m1:m001_n001",
              "PAT-04@m3:m003_n001",
              "PAT-04@m7:m007_n001",
              "PAT-04@m10:m010_n001",
              "PAT-04@m12:m012_n001",
              "PAT-04@m13:m013_n001"
            ],
            "notation": "♩ ♪♪",
            "durations": [
              1,
              0.5,
              0.5
            ],
            "chant": [
              "da",
              "de",
              "de"
            ],
            "bodyActions": [
              "PAT",
              "CLAP",
              "CLAP"
            ],
            "bodyActionsZh": [
              "双手拍腿",
              "拍手",
              "拍手"
            ],
            "bodyMappingSource": "knowledge_base_teaching_asset",
            "previewAudio": "/assets/audio/rhythm/patterns/pat-04.wav",
            "previewMetadata": "/assets/audio/rhythm/patterns/pat-04.metadata.json",
            "trainingTempoRef": "simplePatterns",
            "trainingBpm": 80
          },
          {
            "materialId": "PAT-01",
            "teachingAssetId": "TA-RHY-PAT-01",
            "occurrenceIds": [
              "PAT-01@m5:m005_n001",
              "PAT-01@m9:m009_n001",
              "PAT-01@m11:m011_n001"
            ],
            "notation": "♩ ♩",
            "durations": [
              1,
              1
            ],
            "chant": [
              "da",
              "da"
            ],
            "bodyActions": [
              "STOMP",
              "STOMP"
            ],
            "bodyActionsZh": [
              "原地跺脚",
              "原地跺脚"
            ],
            "bodyMappingSource": "knowledge_base_teaching_asset",
            "previewAudio": "/assets/audio/rhythm/patterns/pat-01.wav",
            "previewMetadata": "/assets/audio/rhythm/patterns/pat-01.metadata.json",
            "trainingTempoRef": "simplePatterns",
            "trainingBpm": 80
          },
          {
            "materialId": "PAT-02",
            "teachingAssetId": "TA-RHY-PAT-02",
            "occurrenceIds": [
              "PAT-02@m6:m006_n001",
              "PAT-02@m14:m014_n001",
              "PAT-02@m15:m015_n001"
            ],
            "notation": "♪♪ ♪♪",
            "durations": [
              0.5,
              0.5,
              0.5,
              0.5
            ],
            "chant": [
              "de",
              "de",
              "de",
              "de"
            ],
            "bodyActions": [
              "CLAP",
              "CLAP",
              "CLAP",
              "CLAP"
            ],
            "bodyActionsZh": [
              "拍手",
              "拍手",
              "拍手",
              "拍手"
            ],
            "bodyMappingSource": "knowledge_base_teaching_asset",
            "previewAudio": "/assets/audio/rhythm/patterns/pat-02.wav",
            "previewMetadata": "/assets/audio/rhythm/patterns/pat-02.metadata.json",
            "trainingTempoRef": "simplePatterns",
            "trainingBpm": 80
          }
        ],
        "lessonSegments": [
          {
            "segmentId": "lesson_segment_m001_m004",
            "index": 0,
            "label": "第 1–4 小节",
            "startMeasure": 1,
            "endMeasure": 4,
            "measureCount": 4,
            "measures": [
              1,
              2,
              3,
              4
            ]
          },
          {
            "segmentId": "lesson_segment_m005_m008",
            "index": 1,
            "label": "第 5–8 小节",
            "startMeasure": 5,
            "endMeasure": 8,
            "measureCount": 4,
            "measures": [
              5,
              6,
              7,
              8
            ]
          },
          {
            "segmentId": "lesson_segment_m009_m012",
            "index": 2,
            "label": "第 9–12 小节",
            "startMeasure": 9,
            "endMeasure": 12,
            "measureCount": 4,
            "measures": [
              9,
              10,
              11,
              12
            ]
          },
          {
            "segmentId": "lesson_segment_m013_m016",
            "index": 3,
            "label": "第 13–16 小节",
            "startMeasure": 13,
            "endMeasure": 16,
            "measureCount": 4,
            "measures": [
              13,
              14,
              15,
              16
            ]
          }
        ],
        "measuresPerUnit": 4,
        "measureAlignmentId": "song_measure_alignment",
        "bodySongPlan": {
          "schemaVersion": "1.0.0",
          "planId": "song_rhythm_body_plan",
          "songId": "dongfanghong",
          "source": "rhythm_learning_pattern_occurrences",
          "mappingContract": "knowledge_base_pattern_actions",
          "unmatchedBehavior": "READY_LISTEN",
          "segments": [
            {
              "segmentId": "lesson_segment_m001_m004",
              "index": 0,
              "label": "第 1–4 小节",
              "startMeasure": 1,
              "endMeasure": 4,
              "measureCount": 4,
              "measures": [
                1,
                2,
                3,
                4
              ],
              "events": [
                {
                  "eventId": "PAT-04@m1:m001_n001#0",
                  "occurrenceId": "PAT-04@m1:m001_n001",
                  "materialId": "PAT-04",
                  "measure": 1,
                  "beat": 0,
                  "durationBeats": 1,